{
  "_type": "https://in-toto.io/Statement/v1",
  "subject": [
    {
      "name": "automap.lock.json",
      "digest": {
        "sha256": "799999d0c8bacaa55388fe26102e7e25700f13fbcc91f34e34728d35e7c9a5af"
      }
    }
  ],
  "predicateType": "https://github.com/zach/automap/evidence/v1",
  "predicate": {
    "subject_kind": "composition",
    "subject_detail": {
      "lock_hash": "sha256:5ab3d9b5a5b6b906382c1928b8fbf4e924e5b69ae9b29e3d00f5384d30c0b3f0"
    },
    "platform": "macos-arm64-appleclang",
    "level": "probed",
    "produced_at": "2026-10-31T11:10:07Z",
    "map_release": "git:6d0e49b04de0f6d0b769e1bb29984b217d352770",
    "conditions": {
      "build_type": "Debug",
      "compiler": "Apple clang version 21.0.0 (clang-2100.1.1.101)",
      "environment": {},
      "runner_image": "macos26 20261026.0455.2",
      "sanitizers": {
        "thread": "separate Debug build with -fsanitize=thread; TSAN_OPTIONS=halt_on_error=0:exitcode=66; the executable run with --probe"
      }
    },
    "results": [
      {
        "rule": "allocation.hooks-before-first-allocation",
        "library": "dear-imgui",
        "status": "pass"
      },
      {
        "rule": "allocation.hooks-before-first-allocation",
        "library": "jolt",
        "status": "pass"
      },
      {
        "rule": "allocation.hooks-before-first-allocation",
        "library": "sdl3",
        "status": "pass"
      },
      {
        "rule": "allocation.routed-through-facade",
        "library": "dear-imgui",
        "status": "pass"
      },
      {
        "rule": "allocation.routed-through-facade",
        "library": "jolt",
        "status": "pass"
      },
      {
        "rule": "allocation.routed-through-facade",
        "library": "sdl3",
        "status": "pass"
      },
      {
        "rule": "build-flags.abi-defines-match",
        "status": "pass"
      },
      {
        "rule": "build-flags.language-settings-agree",
        "status": "pass"
      },
      {
        "rule": "determinism.flags-set",
        "status": "not-applicable",
        "reason": "The composition doesn't choose determinism.profile on."
      },
      {
        "rule": "determinism.replay-hash-matches",
        "library": "jolt",
        "status": "not-applicable",
        "reason": "The composition doesn't choose determinism.profile on."
      },
      {
        "rule": "diagnostics.routed-through-facade",
        "library": "dear-imgui",
        "status": "not-applicable",
        "reason": "Dear ImGui has no runtime log or assert hook; IM_ASSERT is compile-time only."
      },
      {
        "rule": "diagnostics.routed-through-facade",
        "library": "jolt",
        "status": "pass"
      },
      {
        "rule": "diagnostics.routed-through-facade",
        "library": "sdl3",
        "status": "pass"
      },
      {
        "rule": "handles.bits-preserved",
        "library": "jolt",
        "status": "pass"
      },
      {
        "rule": "jobs.routed-through-interface",
        "library": "jolt",
        "status": "pass"
      },
      {
        "rule": "jobs.tsan-clean",
        "status": "pass"
      },
      {
        "rule": "lifecycle.init-order",
        "status": "pass"
      },
      {
        "rule": "lifecycle.shutdown-reverse",
        "status": "pass"
      },
      {
        "rule": "math-types.precision-agrees",
        "status": "pass"
      },
      {
        "rule": "math-types.adapters-round-trip",
        "library": "dear-imgui",
        "status": "not-applicable",
        "reason": "The composition has no library in the math slot."
      },
      {
        "rule": "math-types.adapters-round-trip",
        "library": "jolt",
        "status": "not-applicable",
        "reason": "The composition has no library in the math slot."
      },
      {
        "rule": "platform.targets-supported",
        "status": "pass"
      },
      {
        "rule": "serialization.rebuild-key-complete",
        "library": "jolt",
        "status": "pass"
      },
      {
        "rule": "dear-imgui--sdl3.events-forwarded",
        "status": "pass"
      }
    ],
    "verifier": {
      "kind": "automap-ci",
      "id": "https://github.com/zach/automap/.github/workflows/verify-map.yml@refs/heads/main",
      "signed": true
    }
  }
}
