{
  "_type": "https://in-toto.io/Statement/v1",
  "subject": [
    {
      "name": "pkg:github/jrouwe/JoltPhysics@v5.6.0",
      "digest": {
        "gitCommit": "e77f175595e64cb44218cc9d9d56fc365ad0e36a",
        "sha512": "bc6f2436bef91a6ffd09eee98186be645f6e9a9b3f65a7a645abf00432ac40ada03320c1fe946661817a94eda372cf8d88e4889991cdd25f1c16ecf9a4486677"
      }
    }
  ],
  "predicateType": "https://github.com/zach/automap/evidence/v1",
  "predicate": {
    "subject_kind": "binding",
    "subject_detail": {
      "contract": "math-types",
      "contract_version": "1.0.0",
      "pin": {
        "commit": "e77f175595e64cb44218cc9d9d56fc365ad0e36a",
        "content_hash": "sha512:bc6f2436bef91a6ffd09eee98186be645f6e9a9b3f65a7a645abf00432ac40ada03320c1fe946661817a94eda372cf8d88e4889991cdd25f1c16ecf9a4486677",
        "library": "jolt",
        "variant": "default",
        "version": "5.6.0"
      }
    },
    "platform": "linux-x64-clang",
    "level": "probed",
    "produced_at": "2026-10-31T04:54:24Z",
    "map_release": "git:c813501ad10e473a695c0528a1710fdbf4d6c927",
    "conditions": {
      "build_type": "Debug",
      "compiler": "Ubuntu clang version 21.1.8 (6ubuntu1)",
      "environment": {},
      "runner_image": "ubuntu26 20261026.180.1",
      "sanitizers": {
        "thread": "separate Debug build with -fsanitize=thread; TSAN_OPTIONS=halt_on_error=0:exitcode=66; the executable run with --probe"
      }
    },
    "results": [
      {
        "rule": "math-types.precision-agrees",
        "status": "pass"
      },
      {
        "rule": "math-types.adapters-round-trip",
        "library": "jolt",
        "status": "not-applicable",
        "reason": "The composition has no math library for Jolt's types to convert to."
      }
    ],
    "verifier": {
      "kind": "automap-ci",
      "id": "https://github.com/zach/automap/.github/workflows/verify-map.yml@refs/heads/main",
      "signed": true
    }
  }
}
