{
  "_type": "https://in-toto.io/Statement/v1",
  "subject": [
    {
      "name": "pkg:github/libsdl-org/SDL@release-3.4.18",
      "digest": {
        "gitCommit": "829a65d769d935c4852f8159e964312c0957260a",
        "sha512": "12fcb5592016b27922b08d1580d75f5f15c72e67cf04415e2bd824dc7563ac940c25bbe368b03d0a755f5832803049467e3d0ee6784ed3684792bc4d7741af50"
      }
    }
  ],
  "predicateType": "https://github.com/zach/automap/evidence/v1",
  "predicate": {
    "subject_kind": "binding",
    "subject_detail": {
      "contract": "allocation",
      "contract_version": "1.0.0",
      "pin": {
        "commit": "829a65d769d935c4852f8159e964312c0957260a",
        "content_hash": "sha512:12fcb5592016b27922b08d1580d75f5f15c72e67cf04415e2bd824dc7563ac940c25bbe368b03d0a755f5832803049467e3d0ee6784ed3684792bc4d7741af50",
        "library": "sdl3",
        "variant": "default",
        "version": "3.4.18"
      }
    },
    "platform": "windows-x64-msvc",
    "level": "probed",
    "produced_at": "2026-10-31T23:57:56Z",
    "map_release": "git:53107e03a7ac997669d431148236aeeffd748408",
    "conditions": {
      "build_type": "Debug",
      "compiler": "Microsoft (R) C/C++ Optimizing Compiler Version 19.51.36260 for x64",
      "environment": {},
      "runner_image": "win25-vs2026 20261030.294.1",
      "sanitizers": {}
    },
    "results": [
      {
        "rule": "allocation.hooks-before-first-allocation",
        "library": "sdl3",
        "status": "pass"
      },
      {
        "rule": "allocation.routed-through-facade",
        "library": "sdl3",
        "status": "pass"
      }
    ],
    "verifier": {
      "kind": "automap-ci",
      "id": "https://github.com/zach/automap/.github/workflows/verify-map.yml@refs/heads/main",
      "signed": true
    }
  }
}
