{
  "_type": "https://in-toto.io/Statement/v1",
  "subject": [
    {
      "name": "pkg:github/ocornut/imgui@v1.93.0-docking",
      "digest": {
        "gitCommit": "b916186e66aa3c02b72c6ca17455516512ed8049",
        "sha512": "00ade7a3e2c2e34465f1bb9fafd78733d3e659617b0857cf1b3c7f04cfc1d8566d1fd6a8697946f0de7c808cce1c4d0a4b2195c7bc20144cfd8b1e9b1cfba621"
      }
    }
  ],
  "predicateType": "https://github.com/zach/automap/evidence/v1",
  "predicate": {
    "subject_kind": "binding",
    "subject_detail": {
      "contract": "allocation",
      "contract_version": "1.0.0",
      "pin": {
        "commit": "b916186e66aa3c02b72c6ca17455516512ed8049",
        "content_hash": "sha512:00ade7a3e2c2e34465f1bb9fafd78733d3e659617b0857cf1b3c7f04cfc1d8566d1fd6a8697946f0de7c808cce1c4d0a4b2195c7bc20144cfd8b1e9b1cfba621",
        "library": "dear-imgui",
        "variant": "docking",
        "version": "1.93.0"
      }
    },
    "platform": "linux-x64-clang",
    "level": "probed",
    "produced_at": "2026-10-31T02:34:23Z",
    "map_release": "git:d1ddef8175bc13900951dc79e739bd18bf513892",
    "conditions": {
      "build_type": "Debug",
      "compiler": "Ubuntu clang version 21.1.8 (6ubuntu1)",
      "environment": {},
      "runner_image": "ubuntu26 20261026.180.1",
      "sanitizers": {}
    },
    "results": [
      {
        "rule": "allocation.hooks-before-first-allocation",
        "library": "dear-imgui",
        "status": "pass"
      },
      {
        "rule": "allocation.routed-through-facade",
        "library": "dear-imgui",
        "status": "pass"
      }
    ],
    "verifier": {
      "kind": "automap-ci",
      "id": "https://github.com/zach/automap/.github/workflows/verify-map.yml@refs/heads/main",
      "signed": true
    }
  }
}
