{
  "_type": "https://in-toto.io/Statement/v1",
  "subject": [
    {
      "name": "pkg:github/jrouwe/JoltPhysics@v5.6.0",
      "digest": {
        "gitCommit": "e77f175595e64cb44218cc9d9d56fc365ad0e36a",
        "sha512": "bc6f2436bef91a6ffd09eee98186be645f6e9a9b3f65a7a645abf00432ac40ada03320c1fe946661817a94eda372cf8d88e4889991cdd25f1c16ecf9a4486677"
      }
    }
  ],
  "predicateType": "https://github.com/zach/automap/evidence/v1",
  "predicate": {
    "subject_kind": "binding",
    "subject_detail": {
      "contract": "determinism",
      "contract_version": "1.0.0",
      "pin": {
        "commit": "e77f175595e64cb44218cc9d9d56fc365ad0e36a",
        "content_hash": "sha512:bc6f2436bef91a6ffd09eee98186be645f6e9a9b3f65a7a645abf00432ac40ada03320c1fe946661817a94eda372cf8d88e4889991cdd25f1c16ecf9a4486677",
        "library": "jolt",
        "variant": "deterministic",
        "version": "5.6.0"
      }
    },
    "platform": "linux-x64-clang",
    "level": "none",
    "produced_at": "2026-10-31T20:14:03Z",
    "map_release": "git:b3e580be359201280da006dfa7463f58d88165a3",
    "conditions": {
      "build_type": "Debug",
      "compiler": "Ubuntu clang version 21.1.8 (6ubuntu1)",
      "environment": {},
      "runner_image": "ubuntu26 20261026.180.1",
      "sanitizers": {}
    },
    "results": [
      {
        "rule": "determinism.flags-set",
        "status": "not-applicable",
        "reason": "The composition doesn't choose determinism.profile on."
      },
      {
        "rule": "determinism.replay-hash-matches",
        "library": "jolt",
        "status": "not-applicable",
        "reason": "The composition doesn't choose determinism.profile on."
      }
    ],
    "verifier": {
      "kind": "automap-ci",
      "id": "https://github.com/zach/automap/.github/workflows/verify-map.yml@refs/heads/main",
      "signed": true
    }
  }
}
