{
  "_type": "https://in-toto.io/Statement/v1",
  "subject": [
    {
      "name": "automap.lock.json",
      "digest": {
        "sha256": "b0291df3da79aa27cce23490fcdb32efbf8b267f5220e24114ed8407f0060854"
      }
    }
  ],
  "predicateType": "https://github.com/zach/automap/evidence/v1",
  "predicate": {
    "subject_kind": "composition",
    "subject_detail": {
      "lock_hash": "sha256:45fec406ff27679f65e9ee8f96d7d2ceb852cce8a50027e7d879fd11f866e317"
    },
    "platform": "linux-x64-clang",
    "level": "probed",
    "produced_at": "2026-10-31T04:01:08Z",
    "map_release": "git:940b678c0fe9d628b1b2175e336566bacd05b2c9",
    "conditions": {
      "build_type": "Debug",
      "compiler": "Ubuntu clang version 21.1.8 (6ubuntu1)",
      "environment": {
        "SDL_VIDEO_DRIVER": "offscreen"
      },
      "runner_image": "ubuntu26 20261026.180.1",
      "sanitizers": {}
    },
    "results": [
      {
        "rule": "allocation.hooks-before-first-allocation",
        "library": "dear-imgui",
        "status": "pass"
      },
      {
        "rule": "allocation.hooks-before-first-allocation",
        "library": "sdl3",
        "status": "pass"
      },
      {
        "rule": "allocation.routed-through-facade",
        "library": "dear-imgui",
        "status": "pass"
      },
      {
        "rule": "allocation.routed-through-facade",
        "library": "sdl3",
        "status": "pass"
      },
      {
        "rule": "build-flags.abi-defines-match",
        "status": "pass"
      },
      {
        "rule": "build-flags.language-settings-agree",
        "status": "pass"
      },
      {
        "rule": "diagnostics.routed-through-facade",
        "library": "dear-imgui",
        "status": "not-applicable",
        "reason": "Dear ImGui has no runtime log or assert hook; IM_ASSERT is compile-time only."
      },
      {
        "rule": "diagnostics.routed-through-facade",
        "library": "sdl3",
        "status": "pass"
      },
      {
        "rule": "lifecycle.init-order",
        "status": "pass"
      },
      {
        "rule": "lifecycle.shutdown-reverse",
        "status": "pass"
      },
      {
        "rule": "platform.targets-supported",
        "status": "pass"
      },
      {
        "rule": "dear-imgui--sdl3.events-forwarded",
        "status": "pass"
      }
    ],
    "verifier": {
      "kind": "automap-ci",
      "id": "https://github.com/zach/automap/.github/workflows/verify-map.yml@refs/heads/main",
      "signed": true
    }
  }
}
