{
  "_type": "https://in-toto.io/Statement/v1",
  "subject": [
    {
      "name": "automap.lock.json",
      "digest": {
        "sha256": "9467f31b641866adbb08b0f66b1b154a8028854d3ad7d6647086d5e0f3f8b8a8"
      }
    }
  ],
  "predicateType": "https://github.com/zach/automap/evidence/v1",
  "predicate": {
    "subject_kind": "composition",
    "subject_detail": {
      "lock_hash": "sha256:e2462dce3e67fc7f5755ba6fcc34fbe8820d1b23ae1c741eb50bf45ce3b4f17d"
    },
    "platform": "windows-x64-msvc",
    "level": "probed",
    "produced_at": "2026-11-01T04:08:41Z",
    "map_release": "git:13cf2ff39c13b4d7d0d8efca7d35d5a80fea3cb8",
    "conditions": {
      "build_type": "Debug",
      "compiler": "Microsoft (R) C/C++ Optimizing Compiler Version 19.51.36260 for x64",
      "environment": {},
      "runner_image": "win25-vs2026 20261021.278.1",
      "sanitizers": {}
    },
    "results": [
      {
        "rule": "allocation.hooks-before-first-allocation",
        "library": "dear-imgui",
        "status": "pass"
      },
      {
        "rule": "allocation.hooks-before-first-allocation",
        "library": "sdl3",
        "status": "pass"
      },
      {
        "rule": "allocation.routed-through-facade",
        "library": "dear-imgui",
        "status": "pass"
      },
      {
        "rule": "allocation.routed-through-facade",
        "library": "sdl3",
        "status": "pass"
      },
      {
        "rule": "build-flags.abi-defines-match",
        "status": "pass"
      },
      {
        "rule": "build-flags.language-settings-agree",
        "status": "pass"
      },
      {
        "rule": "diagnostics.routed-through-facade",
        "library": "dear-imgui",
        "status": "not-applicable",
        "reason": "Dear ImGui has no runtime log or assert hook; IM_ASSERT is compile-time only."
      },
      {
        "rule": "diagnostics.routed-through-facade",
        "library": "sdl3",
        "status": "pass"
      },
      {
        "rule": "lifecycle.init-order",
        "status": "pass"
      },
      {
        "rule": "lifecycle.shutdown-reverse",
        "status": "pass"
      },
      {
        "rule": "math-types.precision-agrees",
        "status": "not-applicable",
        "reason": "No library in the composition exposes world positions."
      },
      {
        "rule": "math-types.adapters-round-trip",
        "library": "dear-imgui",
        "status": "not-applicable",
        "reason": "The composition has no library in the math slot."
      },
      {
        "rule": "platform.targets-supported",
        "status": "pass"
      },
      {
        "rule": "dear-imgui--sdl3.events-forwarded",
        "status": "pass"
      }
    ],
    "verifier": {
      "kind": "automap-ci",
      "id": "https://github.com/zach/automap/.github/workflows/verify-map.yml@refs/heads/main",
      "signed": true
    }
  }
}
