{
  "_type": "https://in-toto.io/Statement/v1",
  "subject": [
    {
      "name": "automap.lock.json",
      "digest": {
        "sha256": "ee76402201aa42d2540933bd643c559f1d556753f944029c574cc4824e616c0a"
      }
    }
  ],
  "predicateType": "https://github.com/zach/automap/evidence/v1",
  "predicate": {
    "subject_kind": "composition",
    "subject_detail": {
      "lock_hash": "sha256:8f573cdc1f6902e5eba4a924ee6ba90f39494fd2159c1a300c8c5bbce9120daa"
    },
    "platform": "linux-x64-clang",
    "level": "probed",
    "produced_at": "2026-10-31T23:57:29Z",
    "map_release": "git:53107e03a7ac997669d431148236aeeffd748408",
    "conditions": {
      "build_type": "Debug",
      "compiler": "Ubuntu clang version 21.1.8 (6ubuntu1)",
      "environment": {
        "SDL_VIDEO_DRIVER": "offscreen"
      },
      "runner_image": "ubuntu26 20261026.180.1",
      "sanitizers": {}
    },
    "results": [
      {
        "rule": "allocation.hooks-before-first-allocation",
        "library": "dear-imgui",
        "status": "pass"
      },
      {
        "rule": "allocation.hooks-before-first-allocation",
        "library": "sdl3",
        "status": "pass"
      },
      {
        "rule": "allocation.routed-through-facade",
        "library": "dear-imgui",
        "status": "pass"
      },
      {
        "rule": "allocation.routed-through-facade",
        "library": "sdl3",
        "status": "pass"
      },
      {
        "rule": "assets.reads-through-interface",
        "library": "sdl-shadercross",
        "status": "pass"
      },
      {
        "rule": "assets.output-identical",
        "library": "sdl-shadercross",
        "status": "pass"
      },
      {
        "rule": "build-flags.abi-defines-match",
        "status": "pass"
      },
      {
        "rule": "build-flags.language-settings-agree",
        "status": "pass"
      },
      {
        "rule": "diagnostics.routed-through-facade",
        "library": "dear-imgui",
        "status": "not-applicable",
        "reason": "Dear ImGui has no runtime log or assert hook; IM_ASSERT is compile-time only."
      },
      {
        "rule": "diagnostics.routed-through-facade",
        "library": "sdl3",
        "status": "pass"
      },
      {
        "rule": "lifecycle.init-order",
        "status": "pass"
      },
      {
        "rule": "lifecycle.shutdown-reverse",
        "status": "pass"
      },
      {
        "rule": "math-types.precision-agrees",
        "status": "not-applicable",
        "reason": "No library in the composition exposes world positions."
      },
      {
        "rule": "math-types.adapters-round-trip",
        "library": "dear-imgui",
        "status": "not-applicable",
        "reason": "The composition has no library in the math slot."
      },
      {
        "rule": "platform.targets-supported",
        "status": "pass"
      },
      {
        "rule": "dear-imgui--sdl3.events-forwarded",
        "status": "pass"
      },
      {
        "rule": "sdl-shadercross--sdl3.formats-match-backend",
        "status": "pass"
      },
      {
        "rule": "sdl-shadercross--sdl3.reflection-matches",
        "status": "pass"
      }
    ],
    "verifier": {
      "kind": "automap-ci",
      "id": "https://github.com/zach/automap/.github/workflows/verify-map.yml@refs/heads/main",
      "signed": true
    }
  }
}
