{
  "_type": "https://in-toto.io/Statement/v1",
  "subject": [
    {
      "name": "pkg:github/SanderMertens/flecs@v4.1.6",
      "digest": {
        "gitCommit": "fb55f3c25660425cfe1bc4cf5e6bff8b3f18a9b8",
        "sha512": "a2843d72a4a7f7577e047eac60d492c8a6677dae404d9ec6a23a498f5d37f745897a0892a3a5ef7b66de5c5f862e55cf9ae6b50dc33d0bd7a674707ca93f2b30"
      }
    }
  ],
  "predicateType": "https://github.com/zach/automap/evidence/v1",
  "predicate": {
    "subject_kind": "binding",
    "subject_detail": {
      "contract": "allocation",
      "contract_version": "1.0.0",
      "pin": {
        "commit": "fb55f3c25660425cfe1bc4cf5e6bff8b3f18a9b8",
        "content_hash": "sha512:a2843d72a4a7f7577e047eac60d492c8a6677dae404d9ec6a23a498f5d37f745897a0892a3a5ef7b66de5c5f862e55cf9ae6b50dc33d0bd7a674707ca93f2b30",
        "library": "flecs",
        "variant": "default",
        "version": "4.1.6"
      }
    },
    "platform": "windows-x64-msvc",
    "level": "probed",
    "produced_at": "2026-10-31T09:30:10Z",
    "map_release": "git:40bdef14cdf68b2065def9cf54dc0cd1ce2cd6a2",
    "conditions": {
      "build_type": "Debug",
      "compiler": "Microsoft (R) C/C++ Optimizing Compiler Version 19.51.36260 for x64",
      "environment": {},
      "runner_image": "win25-vs2026 20261021.278.1",
      "sanitizers": {}
    },
    "results": [
      {
        "rule": "allocation.hooks-before-first-allocation",
        "library": "flecs",
        "status": "pass"
      },
      {
        "rule": "allocation.routed-through-facade",
        "library": "flecs",
        "status": "pass"
      }
    ],
    "verifier": {
      "kind": "automap-ci",
      "id": "https://github.com/zach/automap/.github/workflows/verify-map.yml@refs/heads/main",
      "signed": true
    }
  }
}
