{
  "_type": "https://in-toto.io/Statement/v1",
  "subject": [
    {
      "name": "automap.lock.json",
      "digest": {
        "sha256": "6dd0ef21ec3607a5c60160d22e2dcae20fb163b55a798f8b0789a8e2c036a079"
      }
    }
  ],
  "predicateType": "https://github.com/zach/automap/evidence/v1",
  "predicate": {
    "subject_kind": "composition",
    "subject_detail": {
      "lock_hash": "sha256:62dd15fcf40764d039be790e4be0a08f72df4cd17ca6a549f2c6a20eef25f63e"
    },
    "platform": "windows-x64-msvc",
    "level": "probed",
    "produced_at": "2026-10-31T01:35:34Z",
    "map_release": "git:7501e6627c3dc3e4a2057b8e9c4d0b8a63554413",
    "conditions": {
      "build_type": "Debug",
      "compiler": "Microsoft (R) C/C++ Optimizing Compiler Version 19.51.36260 for x64",
      "environment": {},
      "runner_image": "win25-vs2026 20261030.294.1",
      "sanitizers": {}
    },
    "results": [
      {
        "rule": "allocation.hooks-before-first-allocation",
        "library": "dear-imgui",
        "status": "pass"
      },
      {
        "rule": "allocation.hooks-before-first-allocation",
        "library": "jolt",
        "status": "pass"
      },
      {
        "rule": "allocation.hooks-before-first-allocation",
        "library": "sdl3",
        "status": "pass"
      },
      {
        "rule": "allocation.routed-through-facade",
        "library": "dear-imgui",
        "status": "pass"
      },
      {
        "rule": "allocation.routed-through-facade",
        "library": "jolt",
        "status": "pass"
      },
      {
        "rule": "allocation.routed-through-facade",
        "library": "sdl3",
        "status": "pass"
      },
      {
        "rule": "build-flags.abi-defines-match",
        "status": "pass"
      },
      {
        "rule": "build-flags.language-settings-agree",
        "status": "pass"
      },
      {
        "rule": "diagnostics.routed-through-facade",
        "library": "dear-imgui",
        "status": "not-applicable",
        "reason": "Dear ImGui has no runtime log or assert hook; IM_ASSERT is compile-time only."
      },
      {
        "rule": "diagnostics.routed-through-facade",
        "library": "jolt",
        "status": "pass"
      },
      {
        "rule": "diagnostics.routed-through-facade",
        "library": "sdl3",
        "status": "pass"
      },
      {
        "rule": "jobs.routed-through-interface",
        "library": "jolt",
        "status": "pass"
      },
      {
        "rule": "jobs.tsan-clean",
        "status": "not-applicable",
        "reason": "The rule's probe runs only on linux-x64-clang, macos-arm64-appleclang."
      },
      {
        "rule": "lifecycle.init-order",
        "status": "pass"
      },
      {
        "rule": "lifecycle.shutdown-reverse",
        "status": "pass"
      },
      {
        "rule": "math-types.precision-agrees",
        "status": "pass"
      },
      {
        "rule": "math-types.adapters-round-trip",
        "library": "jolt",
        "status": "not-applicable",
        "reason": "The composition has no math library for Jolt's types to convert to."
      },
      {
        "rule": "platform.targets-supported",
        "status": "pass"
      },
      {
        "rule": "dear-imgui--sdl3.events-forwarded",
        "status": "pass"
      }
    ],
    "verifier": {
      "kind": "automap-ci",
      "id": "https://github.com/zach/automap/.github/workflows/verify-map.yml@refs/heads/main",
      "signed": true
    }
  }
}
