{
  "_type": "https://in-toto.io/Statement/v1",
  "subject": [
    {
      "name": "pkg:github/wolfpld/tracy@v0.14.1",
      "digest": {
        "gitCommit": "30997d5ca6bb632cc10807a1da8a6d3de0aeeb3c",
        "sha512": "53912d7563e595812b37bc55fd40508cfd8e5c42d48d957a73b6b7d18bf1287b3f795c10c9a986bf7b906d5b5bebe13b02216e563e794d0a82b2783e8ce5510b"
      }
    }
  ],
  "predicateType": "https://github.com/zach/automap/evidence/v1",
  "predicate": {
    "subject_kind": "binding",
    "subject_detail": {
      "contract": "diagnostics",
      "contract_version": "1.0.0",
      "pin": {
        "commit": "30997d5ca6bb632cc10807a1da8a6d3de0aeeb3c",
        "content_hash": "sha512:53912d7563e595812b37bc55fd40508cfd8e5c42d48d957a73b6b7d18bf1287b3f795c10c9a986bf7b906d5b5bebe13b02216e563e794d0a82b2783e8ce5510b",
        "library": "tracy",
        "variant": "default",
        "version": "0.14.1"
      }
    },
    "platform": "macos-arm64-appleclang",
    "level": "probed",
    "produced_at": "2026-10-31T07:27:38Z",
    "map_release": "git:8dac01b8171925aa50d9dd154a30e035589646f2",
    "conditions": {
      "build_type": "Debug",
      "compiler": "Apple clang version 21.0.0 (clang-2100.1.1.101)",
      "environment": {},
      "runner_image": "macos26 20261013.0424.1",
      "sanitizers": {}
    },
    "results": [
      {
        "rule": "diagnostics.routed-through-facade",
        "library": "tracy",
        "status": "pass"
      }
    ],
    "verifier": {
      "kind": "automap-ci",
      "id": "https://github.com/zach/automap/.github/workflows/verify-map.yml@refs/heads/main",
      "signed": true
    }
  }
}
