{
  "_type": "https://in-toto.io/Statement/v1",
  "subject": [
    {
      "name": "pkg:github/jrouwe/JoltPhysics@v5.6.0",
      "digest": {
        "gitCommit": "e77f175595e64cb44218cc9d9d56fc365ad0e36a",
        "sha512": "bc6f2436bef91a6ffd09eee98186be645f6e9a9b3f65a7a645abf00432ac40ada03320c1fe946661817a94eda372cf8d88e4889991cdd25f1c16ecf9a4486677"
      }
    }
  ],
  "predicateType": "https://github.com/zach/automap/evidence/v1",
  "predicate": {
    "subject_kind": "binding",
    "subject_detail": {
      "contract": "math-types",
      "contract_version": "1.1.0",
      "pin": {
        "commit": "e77f175595e64cb44218cc9d9d56fc365ad0e36a",
        "content_hash": "sha512:bc6f2436bef91a6ffd09eee98186be645f6e9a9b3f65a7a645abf00432ac40ada03320c1fe946661817a94eda372cf8d88e4889991cdd25f1c16ecf9a4486677",
        "library": "jolt",
        "variant": "double-precision",
        "version": "5.6.0"
      }
    },
    "platform": "windows-x64-msvc",
    "level": "smoke",
    "produced_at": "2026-11-01T04:13:33Z",
    "map_release": "git:13cf2ff39c13b4d7d0d8efca7d35d5a80fea3cb8",
    "conditions": {
      "build_type": "Debug",
      "compiler": "Microsoft (R) C/C++ Optimizing Compiler Version 19.51.36260 for x64",
      "environment": {},
      "runner_image": "win25-vs2026 20261021.278.1",
      "sanitizers": {}
    },
    "results": [
      {
        "rule": "math-types.precision-agrees",
        "status": "fail",
        "failure_code": "PRECISION_MISMATCH(jolt)",
        "reason": "jolt uses double world positions, but the composition chooses float."
      },
      {
        "rule": "math-types.adapters-round-trip",
        "library": "jolt",
        "status": "not-applicable",
        "reason": "The composition has no library in the math slot."
      }
    ],
    "verifier": {
      "kind": "automap-ci",
      "id": "https://github.com/zach/automap/.github/workflows/verify-map.yml@refs/heads/main",
      "signed": true
    }
  }
}
