{
  "_type": "https://in-toto.io/Statement/v1",
  "subject": [
    {
      "name": "pkg:github/jrouwe/JoltPhysics@v5.6.0",
      "digest": {
        "gitCommit": "e77f175595e64cb44218cc9d9d56fc365ad0e36a",
        "sha512": "bc6f2436bef91a6ffd09eee98186be645f6e9a9b3f65a7a645abf00432ac40ada03320c1fe946661817a94eda372cf8d88e4889991cdd25f1c16ecf9a4486677"
      }
    }
  ],
  "predicateType": "https://github.com/zach/automap/evidence/v1",
  "predicate": {
    "subject_kind": "binding",
    "subject_detail": {
      "contract": "serialization",
      "contract_version": "1.0.0",
      "pin": {
        "commit": "e77f175595e64cb44218cc9d9d56fc365ad0e36a",
        "content_hash": "sha512:bc6f2436bef91a6ffd09eee98186be645f6e9a9b3f65a7a645abf00432ac40ada03320c1fe946661817a94eda372cf8d88e4889991cdd25f1c16ecf9a4486677",
        "library": "jolt",
        "variant": "default",
        "version": "5.6.0"
      }
    },
    "platform": "windows-x64-msvc",
    "level": "probed",
    "produced_at": "2026-10-31T13:17:31Z",
    "map_release": "git:f18e13a3be5e1a8a12736961ab3d19a13484a654",
    "conditions": {
      "build_type": "Debug",
      "compiler": "Microsoft (R) C/C++ Optimizing Compiler Version 19.51.36260 for x64",
      "environment": {},
      "runner_image": "win25-vs2026 20261030.294.1",
      "sanitizers": {}
    },
    "results": [
      {
        "rule": "serialization.rebuild-key-complete",
        "library": "jolt",
        "status": "pass"
      }
    ],
    "verifier": {
      "kind": "automap-ci",
      "id": "https://github.com/zach/automap/.github/workflows/verify-map.yml@refs/heads/main",
      "signed": true
    }
  }
}
