{
  "_type": "https://in-toto.io/Statement/v1",
  "subject": [
    {
      "name": "pkg:github/microsoft/mimalloc@v3.5.3",
      "digest": {
        "gitCommit": "d4881d338125e1cb7c47ba4cfb398d6f7c0c8d45",
        "sha512": "ef24d926153eb81c95e6c79c335eed12c6e14523a2dd817faddc3f666909a244eab5f4be43cc01a6d8c8d62b5695d29fb535b3762128cdef50a7ee55302b2886"
      }
    }
  ],
  "predicateType": "https://github.com/zach/automap/evidence/v1",
  "predicate": {
    "subject_kind": "binding",
    "subject_detail": {
      "contract": "diagnostics",
      "contract_version": "1.0.0",
      "pin": {
        "commit": "d4881d338125e1cb7c47ba4cfb398d6f7c0c8d45",
        "content_hash": "sha512:ef24d926153eb81c95e6c79c335eed12c6e14523a2dd817faddc3f666909a244eab5f4be43cc01a6d8c8d62b5695d29fb535b3762128cdef50a7ee55302b2886",
        "library": "mimalloc",
        "variant": "default",
        "version": "3.5.3"
      }
    },
    "platform": "linux-x64-clang",
    "level": "probed",
    "produced_at": "2026-10-31T04:52:10Z",
    "map_release": "git:c813501ad10e473a695c0528a1710fdbf4d6c927",
    "conditions": {
      "build_type": "Debug",
      "compiler": "Ubuntu clang version 21.1.8 (6ubuntu1)",
      "environment": {},
      "runner_image": "ubuntu26 20261026.180.1",
      "sanitizers": {}
    },
    "results": [
      {
        "rule": "diagnostics.routed-through-facade",
        "library": "mimalloc",
        "status": "pass"
      }
    ],
    "verifier": {
      "kind": "automap-ci",
      "id": "https://github.com/zach/automap/.github/workflows/verify-map.yml@refs/heads/main",
      "signed": true
    }
  }
}
